Language,Pack_Number,Pack_Title,Row_Number,Column_Name,Old_Value,New_Value,Reason
chinese,80,Personality Traits,10,spanish,Humorístico,Gracioso,Use common adjective for a humorous person.
chinese,80,Personality Traits,10,french,Humoristique,Drôle,Use everyday adjective for someone funny.
chinese,80,Personality Traits,10,portuguese,Humorístico,Engraçado,Use natural term for a humorous person.
chinese,80,Personality Traits,45,english,Hot temper,Short-tempered,More natural description of easily angered personality.
chinese,80,Personality Traits,45,spanish,Temperamento caliente,Mal genio,Use common phrasing for someone who angers easily.
chinese,80,Personality Traits,45,french,Tempérament chaud,Caractère colérique,Use natural expression for short-tempered.
chinese,80,Personality Traits,45,portuguese,Temperamento quente,Gênio explosivo,Use common wording for short-tempered personality.
