Pack_Number,Pack_Title,Difficulty_Act,English_Words,manual_base_word_count
1,Greetings & Basics,Act I: Foundation,"[hello there, hello everyone, hello friend, hi mom, hi guys, hi there, goodbye for now, goodbye my friend, goodbye everyone, bye for now, bye bye, bye everyone, good morning sir, good morning class, good morning everyone, good afternoon ma'am, good afternoon everyone, good afternoon ladies, good evening sir, good evening everyone, good evening folks, good night sweetheart, good night everyone, good night dear, please help me, please sit down, please come in, thank you so much, thank you very much, thank you for coming, thanks a lot, thanks for helping, thanks anyway, sorry about that, sorry I'm late, sorry to bother you, excuse me sir, excuse me please, excuse me for a moment, yes please, yes of course, yes indeed, no thanks, no problem, no way, okay fine, okay sure, okay then, welcome home, welcome aboard, welcome back, how are you doing, how are you feeling, how are you today, nice to meet you too, nice to meet you finally, nice to meet you all, see you later alligator, see you later tonight, see you later everyone]",20
2,Numbers 1-20,Act I: Foundation,"[one apple, one day, one moment, two hands, two weeks, two people, three times, three years, three brothers, four seasons, four corners, four legs, five minutes, five dollars, five fingers, six months, six pack, six feet, seven days, seven years, seven wonders, eight hours, eight o'clock, eight people, nine lives, nine months, nine o'clock, ten minutes, ten dollars, ten years, eleven o'clock, eleven players, eleven months, twelve months, twelve hours, twelve eggs, thirteen years old, thirteen floors, thirteen reasons, fourteen days, fourteen years, fourteen hundred, fifteen minutes, fifteen dollars, fifteen years, sixteen candles, sixteen years old, sixteen hundred, seventeen years old, seventeen hundred, seventeen again, eighteen years old, eighteen holes, eighteen wheels, nineteen years old, nineteen hundred, nineteen ninety, twenty dollars, twenty minutes, twenty years]",20
3,Numbers & Counting,Act I: Foundation,"[thirty days, thirty minutes, thirty years, forty hours, forty dollars, forty years, fifty percent, fifty dollars, fifty people, sixty seconds, sixty minutes, sixty years, seventy degrees, seventy percent, seventy years, eighty percent, eighty dollars, eighty years, ninety percent, ninety degrees, ninety days, one hundred percent, a hundred dollars, a hundred years, a thousand times, a thousand dollars, a thousand miles, a million dollars, a million people, a million times, the first time, the first day, the first one, the second time, the second floor, the second place, the third time, the third floor, the third one, zero degrees, zero chance, zero tolerance, once a week, once upon a time, once again, twice a day, twice a week, twice as much, half price, half an hour, half empty, a quarter past, a quarter mile, a quarter cup, double check, double the price, double or nothing, the last time, the last one, the last day]",20
4,Articles & Determiners,Act I: Foundation,"[a book, a car, a person, an apple, an hour, an idea, the house, the sun, the best, this book, this morning, this way, that car, that day, that person, these days, these books, these people, those shoes, those things, those days, some water, some people, some time, any questions, any time, any help, no problem, no idea, no way, every day, every time, every person, each person, each time, each one, all day, all the time, all of us, both hands, both sides, both of us, either way, either one, either side, neither one, neither side, neither of us, another day, another chance, another one, other people, other things, other options, such a thing, such a beautiful day, such a nice person, my own car, your own room, their own house]",20
5,Quantifiers,Act I: Foundation,"[many people, many times, many years, much better, too much, how much, more time, more money, more people, most people, most of the time, most important, few people, a few days, very few, a little bit, a little water, a little help, less time, less money, much less, the least, at least, least important, enough time, enough money, enough sleep, several times, several people, several years, plenty of time, plenty of food, plenty of room, none of them, none of us, none left, total amount, large amount, small amount, the number of, a number of, phone number, a few minutes, a few things, quite a few, a little while, a little more, a little tired, a lot of people, a lot of time, a lot of money, most of them, most of us, most likely, some of them, some of us, some of the time, all of them, all of us, all of the time]",20
6,Contractions,Act I: Foundation,"[I'm fine, I'm sorry, I'm coming, you're right, you're welcome, you're amazing, he's here, he's coming, he's gone, she's nice, she's busy, she's coming, it's okay, it's fine, it's time, we're here, we're ready, we're coming, they're coming, they're here, they're nice, I've been there, I've got it, I've seen it, you've got mail, you've been great, you've changed, we've arrived, we've finished, we've decided, they've left, they've arrived, they've gone, I'll be there, I'll call you, I'll do it, you'll see, you'll be fine, you'll love it, he'll come, he'll be back, he'll understand, she'll be here, she'll know, she'll help, we'll see, we'll wait, we'll manage, they'll come, they'll understand, they'll be fine, I'd love to, I'd like that, I'd rather not, you'd better go, you'd be surprised, you'd like it, we'd like to, we'd be happy, we'd appreciate it]",20
7,Contractions 2,Act I: Foundation,"[don't worry, don't forget, don't go, doesn't matter, doesn't work, doesn't make sense, didn't know, didn't see, didn't mean to, can't wait, can't believe it, can't help it, couldn't sleep, couldn't find it, couldn't agree more, won't happen, won't work, won't take long, wouldn't say, wouldn't know, wouldn't mind, shouldn't do that, shouldn't worry, shouldn't take long, isn't it nice, isn't that right, isn't working, aren't you coming, aren't we lucky, aren't they cute, wasn't there, wasn't expecting that, wasn't sure, weren't you there, weren't they coming, weren't we supposed to, hasn't arrived, hasn't changed, hasn't been easy, haven't seen you, haven't decided, haven't finished, hadn't thought of that, hadn't realized, hadn't noticed, let's go, let's see, let's try, that's right, that's great, that's interesting, there's no way, there's a problem, there's hope, here's the thing, here's your order, here's what happened, what's wrong, what's up, what's happening]",20
8,Common Expressions,Act I: Foundation,"[I don't know why, I don't know yet, I honestly don't know, I think so too, I think so anyway, I don't think so, me too actually, yeah me too, me neither honestly, no problem at all, no problem man, no problem whatsoever, you're welcome anytime, you're very welcome, always welcome, of course not, of course you can, but of course, by the way did you hear, oh by the way, by the way thanks, right now actually, not right now, do it right now, come on let's go, oh come on, come on in, hold on a sec, hold on tight, hold on I'm coming, let me see that, let me think about it, let me help you, I mean seriously, I mean come on, you know what I mean, you know what happened, you know better than that, you never know, kind of like that, I'm kind of busy, that's kind of weird, sort of like this, that's sort of funny, sort of true actually, what about you though, what about tomorrow instead, what about this one, how about we go, how about you try, how about that idea, no way really, no way that's crazy, there's no way, for sure I'll come, for sure yeah, that's for sure true, my bad sorry, that's my bad, totally my bad]",20
9,Colors,Act I: Foundation,"[red car, red wine, bright red, blue sky, blue eyes, dark blue, green grass, green light, dark green, yellow sun, yellow taxi, bright yellow, orange juice, orange color, bright orange, purple dress, purple rain, deep purple, pink flower, pink color, hot pink, black coffee, black cat, pure black, white snow, white shirt, pure white, gray hair, gray sky, dark gray, brown hair, brown sugar, dark brown, gold medal, gold ring, solid gold, silver ring, silver screen, pure silver, dark room, dark night, dark side, light blue, light green, light skin, bright colors, bright light, bright idea, the color red, favorite color, what color, colored pencils, brightly colored, multi-colored, pale blue, pale skin, pale face, nice tan, sun tan, fake tan]",20
10,Days & Time,Act I: Foundation,"[Monday morning, Monday night, every Monday, Tuesday afternoon, next Tuesday, last Tuesday, Wednesday evening, this Wednesday, every Wednesday, Thursday night, next Thursday, last Thursday, Friday night, this Friday, every Friday, Saturday morning, Saturday night, every Saturday, Sunday afternoon, Sunday morning, every Sunday, today is good, later today, earlier today, tomorrow morning, tomorrow night, see you tomorrow, yesterday morning, yesterday afternoon, since yesterday, this week, next week, last week, the weekend, this weekend, long weekend, early morning, tomorrow morning, Monday morning, late afternoon, yesterday afternoon, this afternoon, Friday evening, yesterday evening, this evening, last night, tomorrow night, every night, all day long, the other day, day after day, one hour later, half an hour, an hour ago, just a minute, one minute please, wait a minute, a few seconds, thirty seconds, every second]",20
11,Months & Seasons,Act I: Foundation,"[January first, in January, last January, February fourteenth, in February, next February, March madness, in March, early March, April showers, April fool, in April, May day, in May, early May, June wedding, in June, late June, July fourth, in July, mid July, August heat, in August, late August, September eleventh, in September, early September, October fest, in October, late October, November rain, in November, early November, December holiday, in December, late December, spring break, spring time, early spring, summer vacation, summer time, hot summer, fall season, in the fall, early fall, cold winter, winter time, harsh winter, this year, next year, last year, every month, next month, last month, rainy season, holiday season, off season, what's the date, save the date, expiration date]",20
12,Family,Act I: Foundation,"[my mother, your mother, his mother, my father, your father, her father, call mom, ask mom, thanks mom, hey dad, ask dad, call dad, older sister, younger sister, my sister, older brother, younger brother, my brother, only son, your son, their son, only daughter, your daughter, their daughter, my grandmother, visit grandmother, paternal grandmother, my grandfather, visit grandfather, paternal grandfather, favorite aunt, my aunt, visit aunt, my uncle, favorite uncle, visit uncle, my cousin, your cousin, our cousin, my husband, your husband, her husband, my wife, your wife, his wife, my parents, your parents, his parents, young children, their children, our children, newborn baby, cute baby, baby shower, extended family, my family, your family, close relative, distant relative, blood relative]",20
13,Body Parts,Act I: Foundation,"[my head, hit my head, shake your head, pretty face, her face, wash your face, blue eye, my eye, close your eyes, left ear, my ear, cover your ears, runny nose, my nose, blow your nose, open mouth, my mouth, shut your mouth, white teeth, brush your teeth, my teeth, long hair, her hair, brush your hair, stiff neck, my neck, neck pain, broad shoulder, my shoulder, shoulder bag, right arm, broken arm, arm wrestling, left hand, shake hands, right hand, index finger, middle finger, ring finger, left leg, broken leg, leg room, left foot, right foot, on foot, big toe, my toe, stubbed toe, lower back, back pain, my back, upset stomach, stomach ache, my stomach, broken heart, my heart, heart attack, human brain, my brain, brain power]",20
14,Personal Pronouns,Act I: Foundation,"[I know, I think, I understand, help me, call me, tell me, thank you, for you, with you, he said, he knows, he thinks, ask him, tell him, help him, she said, she knows, she thinks, ask her, tell her, help her, it works, it happens, do it, we know, we think, we understand, help us, with us, join us, they know, they think, they said, help them, with them, ask them, I did it myself, by myself, for myself, do it yourself, by yourself, for yourself, he did it himself, by himself, for himself, she did it herself, by herself, for herself, it fixed itself, by itself, for itself, we did it ourselves, by ourselves, for ourselves, they did it themselves, by themselves, for themselves, one might think, one could say, one never knows]",20
15,Possessives & Relatives,Act I: Foundation,"[my book is here, that's my house, I'll take my car, it's your turn now, that's your choice, not my problem it's your problem, it was his idea, that's his fault, I respect his decision, what's her name again, she grabbed her bag, it's her choice, I like its color, check its size, what's its purpose, welcome to our house, go team go our team, stick to our plan, that's their car over there, their house is huge, it's their decision, this book is mine, this one is mine, the last slice is mine, is this pen yours, the win is all yours, I think that's yours, that bag is hers, the credit is hers, I'm pretty sure it's hers, this house is ours, the victory is ours, all of this is ours, that car is theirs, the responsibility is theirs, everything here is theirs, who is that guy, honestly who knows, who even cares, to whom it may concern, for whom the bell tolls, with whom did you go, whose turn is it, whose book is this, whose bright idea was that, which one do you want, which way should we go, which color looks better, what is that thing, what happened to you, what do we do now, whoever wants it can have it, whoever comes first wins, whoever said that was wrong, whatever you want is fine, whatever happens happens, whatever works for you, whichever one you prefer, whichever way works, whichever is easier]",23
16,Question Words,Act I: Foundation,"[what is this, what happened, what time, where is it, where are you, where should I, when is it, when did you, when should we, why not, why me, why did you, how are you, how much, how long, which one, which way, which color, how much is it, how much time, how much longer, how many people, how many times, how many left, how often do you, how often should I, how often does it, how long does it take, how long will it, how long have you, how far is it, how far away, how far can you, how old are you, how old is it, how old was he, what time is it, what time should we, what time does it, what kind of, what kind of food, what kind of person, how about you, how about tomorrow, how about this one, what about that, what about tomorrow, what about you, what if I, what if we, what if it, why not try, why not go, why not just, how come you, how come it, how come nobody, what for exactly, what for though, what's that for]",20
17,Modal Verbs,Act I: Foundation,"[I can help, can you hear me, you can do it, I could try, could you please, could be better, I will go, will you come, it will work, I would like, would you mind, that would be great, shall we go, shall I help, shall we begin, you should try, I should go, we should talk, it may rain, may I help, may I ask, I might go, it might work, might be true, I must go, you must try, we must hurry, I have to go, you have to try, we have to talk, I need to go, you need to rest, we need to talk, you ought to try, I ought to know, we ought to go, I'm able to help, are you able to, will be able to, going to rain, I'm going to try, we're going to win, I used to live, she used to work, we used to play, you had better go, I had better leave, we had better hurry, I would rather stay, would rather not, I'd rather wait, I would like some, would you like to, she would like that, supposed to be, I'm supposed to go, you're supposed to know, allowed to go, not allowed to, are we allowed to]",20
18,Essential Verbs: Be & Have,Act I: Foundation,"[be careful, be quiet, be patient, it is good, it is time, it is true, I am ready, I am here, I am sorry, you are right, you are welcome, you are amazing, I was wrong, I was there, I was tired, we were happy, they were late, you were right, I've been busy, has been great, have been waiting, being careful, being honest, being patient, I have time, I have no idea, I have a question, he has a car, she has talent, it has been fun, I had a dream, we had fun, they had time, having fun, having trouble, having dinner, I do agree, I do understand, do you know, he does well, she does too, it does work, I did it, you did well, we did it, done already, well done, all done, doing well, doing fine, doing great, I get it, I get up early, you get better, he gets tired, she gets angry, it gets cold, I got it, we got lucky, they got lost]",20
19,Essential Verbs: Go & Come,Act I: Foundation,"[let's go home, go to work, go outside, he goes daily, she goes first, it goes well, I went home, we went shopping, they went away, all gone now, be gone, long gone, going home, going well, going crazy, I'll come back, come here please, come with me, she comes often, he comes first, it comes naturally, I came early, we came together, they came late, coming soon, coming home, coming back, please leave now, leave me alone, time to leave, I left early, she left already, they left home, I'll arrive soon, arrive on time, when you arrive, please return soon, return the favor, return home, enter the room, please enter here, enter the building, please exit here, exit the building, emergency exit, stay here please, stay calm, stay focused, bring it here, bring your friend, bring some food, I brought lunch, she brought flowers, he brought gifts, I'll take it, take your time, take a seat, I took it, she took notes, they took pictures]",20
20,Essential Verbs: Common Actions,Act I: Foundation,"[make breakfast for me, let's make a decision, we can make it work, I made dinner last night, she made great coffee, we made some plans, give me more time, give it a try please, give her my regards, I gave up on that, he gave good advice, they finally gave permission, let me see it, see you later man, I see what you mean now, I saw him yesterday, she saw it coming, we saw them leave, known worldwide for this, she's well known, known for years now, I know him well, I know what you mean exactly, I know the answer already, I knew it would happen, she knew better than that, they knew nothing about it, I think so too, I think about it often, you should think twice, I thought so too, we thought about it carefully, I thought it was over, I want that one, I want to go home, I want more time, I need your help, I need more time, I need to know now, I like it a lot, I like this one better, I like your style man, I love it so much, I love you too, I love this place already, I'll say this much, I must say I'm impressed, say hello to her, I said yes finally, she said no way, he said so himself, please tell me everything, always tell the truth, tell me more about it, I told you so, she told me everything, he told everyone already, don't ask me why, ask her yourself, nobody asked you]",20
21,Essential Verbs: Daily Actions,Act I: Foundation,"[eat breakfast, eat healthy, eat something, I ate already, she ate lunch, we ate dinner, drink water, drink coffee, drink some tea, I drank too much, she drank juice, they drank everything, sleep well, sleep tight, I can't sleep, I slept late, she slept well, we slept in, wake up early, wake up now, time to wake up, I woke up late, she woke up early, he woke up tired, walk slowly, walk with me, walk the dog, run fast, run away, run for help, I ran late, she ran quickly, they ran away, sit down please, sit here, sit still, I sat down, she sat quietly, we sat together, stand up please, stand still, stand back, I stood up, she stood there, they stood waiting, open the door, open wide, open your book, close the door, close your eyes, close the window, let's start now, start over, start working, stop it now, stop talking, stop right there, wait here please, please wait, wait for me]",20
22,Essential Verbs: Communication,Act I: Foundation,"[speak slowly, speak clearly, speak English, I spoke too soon, she spoke well, he spoke first, spoken language, well spoken, soft spoken, talk to me, talk later, let's talk, I listen carefully, listen to me, please listen, I hear you, I hear something, I hear what you're saying, I heard that, she heard nothing, we heard everything, ask questions, ask for help, ask permission, I'll answer that, answer me please, answer the phone, read carefully, read aloud, read the instructions, I'll write later, write it down, write your name, I wrote it, she wrote back, they wrote everything, written permission, well written, written instructions, learn quickly, learn something new, learn from mistakes, teach me please, teach yourself, teach others, she taught me, he taught well, they taught us, watch carefully, watch out, watch this, look here, look at this, look around, show me please, show your work, show some respect, I'll show you, she showed me, they showed up]",20
23,Irregular Verbs 1,Act I: Foundation,"[buy groceries, buy online, buy some time, I bought it, she bought food, they bought tickets, sell fast, sell online, sell everything, I sold it, she sold out, they sold quickly, pay attention, pay the bill, pay cash, I paid already, she paid extra, they paid nothing, send help, send a message, send it back, I sent it, she sent flowers, they sent regards, spend time, spend wisely, spend money, I spent too much, she spent hours, they spent everything, build trust, build a house, build strength, I built it, she built her career, they built together, catch the ball, catch a cold, catch my drift, I caught it, she caught on, they caught him, choose wisely, choose one, choose carefully, I chose this, she chose well, they chose differently, draw a picture, draw attention, draw conclusions, I drew it, she drew well, they drew lots, drive safely, drive home, drive carefully, I drove there, she drove fast, they drove away]",20
24,Irregular Verbs 2,Act I: Foundation,"[fall down, fall asleep, fall in love, I fell down, she fell hard, they fell behind, falling apart, falling down, falling asleep, feel better, feel free, feel good, I felt sick, she felt better, they felt happy, fight back, fight fair, fight for it, I fought hard, she fought back, they fought bravely, find out, find a way, find something, I found it, she found out, they found nothing, fly high, fly away, fly home, I flew there, she flew solo, they flew together, flown away, has flown, had flown, forget it, forget about it, forget everything, I forgot completely, she forgot again, they forgot nothing, forgotten password, long forgotten, never forgotten, grow up, grow fast, grow stronger, I grew up here, she grew tired, they grew apart, grown up now, fully grown, has grown, hide something, hide away, hide the truth, I hid it, she hid well, they hid everything]",20
25,Irregular Verbs 3,Act I: Foundation,"[hold on, hold tight, hold this, I held on, she held tight, they held hands, keep going, keep trying, keep it, I kept quiet, she kept trying, they kept walking, lose weight, lose hope, lose track, I lost it, she lost hope, they lost everything, meet later, meet someone, nice to meet you, I met her, we met yesterday, they met online, put it here, put away, put down, I put it there, she put effort, they put together, ride a bike, ride along, ride home, I rode there, she rode well, they rode together, ring the bell, ring me later, ring a bell, I rang twice, she rang back, the bell rang, rise up, rise early, rise above, I rose early, she rose quickly, the sun rose, set the table, set a goal, set it down, I set it, she set goals, they set off, shake hands, shake well, shake it off, I shook hands, she shook nervously, they shook violently]",20
26,Irregular Verbs 4,Act I: Foundation,"[sing along with me, sing it loudly, let's sing a song, I sang along yesterday, she sang so beautifully, we all sang together, I've sung this before, she has sung here, never sung in public, please sit down, sit still for a second, come sit here, I sat there quietly, she finally sat down, they sat together talking, speak up I can't hear, speak more clearly, feel free to speak freely, I spoke too honestly, she spoke first at the meeting, they spoke way too loudly, swim faster come on, you swim really well, I try to swim daily, I swam pretty far, she swam so quickly, they swam together yesterday, throw it away please, just throw it here, let's throw a party, I threw it out, she threw it hard, understand why this happened, I need to understand this, I finally understood it, she understood completely, they never understood, wear something nice tonight, you wear it well, I wore my best suit, she wore red yesterday, they all wore uniforms, win this one easily, we're gonna win big, let's win the game, I finally won, she won so easily, break free from this, don't break it please, I broke it accidentally, she finally broke free, they broke up last week, begin now don't wait, let's begin again, I began working early, she began slowly at first, they began together, don't break the rules, she broke down crying, everything fell apart]",20
