english,chinese,pinyin,spanish,portuguese
sing along with me,跟我一起唱,gēn wǒ yìqǐ chàng,canta conmigo,cante comigo
sing it loudly,大声唱,dàshēng chàng,cántalo fuerte,cante alto
let's sing a song,我们唱首歌吧,wǒmen chàng shǒu gē ba,cantemos una canción,vamos cantar uma música
I sang along yesterday,我昨天跟着唱了,wǒ zuótiān gēn zhe chàng le,canté ayer,eu cantei junto ontem
she sang so beautifully,她唱得真美,tā chàng de zhēn měi,ella cantó tan hermoso,ela cantou tão bonito
we all sang together,我们一起唱,wǒmen yìqǐ chàng,todos cantamos juntos,nós todos cantamos juntos
I've sung this before,我唱过这个,wǒ chàngguo zhège,he cantado esto antes,eu já cantei isso
she has sung here,她在这唱过,tā zài zhè chàngguo,ella ha cantado aquí,ela já cantou aqui
never sung in public,从没在公开场合唱过,cóng méi zài gōngkāi chǎnghé chàngguo,nunca cantado en público,nunca cantei em público
please sit down,请坐,qǐng zuò,siéntate por favor,senta por favor
sit still for a second,坐好一会,zuò hǎo yīhuì,quédate quieto un segundo,fica quieto um segundo
come sit here,来这坐,lái zhè zuò,ven siéntate aquí,vem sentar aqui
I sat there quietly,我安静地坐在那,wǒ ānjìng de zuò zài nà,me senté allí tranquilo,eu sentei lá quieto
she finally sat down,她终于坐下了,tā zhōngyú zuò xià le,ella finalmente se sentó,ela finalmente sentou
they sat together talking,他们坐在一起聊天,tāmen zuò zài yìqǐ liáotiān,se sentaron juntos hablando,eles sentaram juntos conversando
speak up I can't hear,大声点我听不见,dàshēng diǎn wǒ tīng bu jiàn,habla más fuerte no oigo,fala mais alto não ouço
speak more clearly,说清楚点,shuō qīngchu diǎn,habla más claro,fale mais claro
feel free to speak freely,随意说,suíyì shuō,siéntete libre de hablar,fique à vontade para falar
I spoke too honestly,我说得太直了,wǒ shuō de tài zhí le,hablé demasiado honesto,eu falei honesto demais
she spoke first at the meeting,她在会上先说的,tā zài huì shang xiān shuō de,ella habló primero en la reunión,ela falou primeiro na reunião
they spoke way too loudly,他们说话太大声了,tāmen shuōhuà tài dàshēng le,hablaron demasiado fuerte,eles falaram alto demais
swim faster come on,游快点,yóu kuài diǎn,nada más rápido,nade mais rápido
you swim really well,你游得真好,nǐ yóu de zhēn hǎo,nadas muy bien,você nada muito bem
I try to swim daily,我尽量每天游泳,wǒ jǐnliàng měitiān yóuyǒng,intento nadar diario,eu tento nadar todo dia
I swam pretty far,我游得挺远,wǒ yóu de tǐng yuǎn,nadé bastante lejos,eu nadei bem longe
she swam so quickly,她游得真快,tā yóu de zhēn kuài,ella nadó tan rápido,ela nadou tão rápido
they swam together yesterday,他们昨天一起游泳,tāmen zuótiān yìqǐ yóuyǒng,nadaron juntos ayer,eles nadaram juntos ontem
throw it away please,请扔掉,qǐng rēng diào,tíralo por favor,jogue fora por favor
just throw it here,扔这就行,rēng zhè jiù xíng,solo tíralo aquí,só joga aqui
let's throw a party,我们办个派对吧,wǒmen bàn gè pàiduì ba,hagamos una fiesta,vamos fazer uma festa
I threw it out,我扔了,wǒ rēng le,lo tiré,eu joguei fora
she threw it hard,她扔得很用力,tā rēng de hěn yònglì,ella lo tiró fuerte,ela jogou forte
understand why this happened,理解为什么会这样,lǐjiě wèishénme huì zhèyàng,entiende por qué pasó,entenda por que isso aconteceu
I need to understand this,我需要理解这个,wǒ xūyào lǐjiě zhège,necesito entender esto,eu preciso entender isso
I finally understood it,我终于明白了,wǒ zhōngyú míngbai le,finalmente lo entendí,eu finalmente entendi
she understood completely,她完全明白,tā wánquán míngbai,ella entendió completamente,ela entendeu completamente
they never understood,他们从不明白,tāmen cóng bù míngbai,nunca entendieron,eles nunca entenderam
wear something nice tonight,今晚穿好看点,jīnwǎn chuān hǎokàn diǎn,usa algo bonito esta noche,use algo bonito esta noite
you wear it well,你穿得好看,nǐ chuān de hǎokàn,te queda bien,você veste bem
I wore my best suit,我穿了最好的西装,wǒ chuān le zuì hǎo de xīzhuāng,usé mi mejor traje,eu usei meu melhor terno
she wore red yesterday,她昨天穿红色,tā zuótiān chuān hóngsè,ella usó rojo ayer,ela usou vermelho ontem
they all wore uniforms,他们都穿制服,tāmen dōu chuān zhìfú,todos usaron uniformes,eles todos usaram uniformes
win this one easily,轻松赢这场,qīngsōng yíng zhè chǎng,gana este fácil,ganhe este fácil
we're gonna win big,我们会大胜,wǒmen huì dà shèng,vamos a ganar en grande,nós vamos ganhar muito
let's win the game,我们赢这场比赛,wǒmen yíng zhè chǎng bǐsài,ganemos el juego,vamos ganhar o jogo
I finally won,我终于赢了,wǒ zhōngyú yíng le,finalmente gané,eu finalmente ganhei
she won so easily,她赢得太轻松了,tā yíng de tài qīngsōng le,ella ganó tan fácil,ela ganhou tão fácil
break free from this,摆脱这个,bǎituō zhège,libérate de esto,liberte-se disso
don't break it please,别弄坏了,bié nònghuài le,no lo rompas por favor,não quebre por favor
I broke it accidentally,我不小心弄坏了,wǒ bù xiǎoxīn nònghuài le,lo rompí accidentalmente,eu quebrei sem querer
she finally broke free,她终于挣脱了,tā zhōngyú zhèngtuō le,ella finalmente se liberó,ela finalmente se libertou
they broke up last week,他们上周分手了,tāmen shàngzhōu fēnshǒu le,terminaron la semana pasada,eles terminaram semana passada
begin now don't wait,现在开始别等,xiànzài kāishǐ bié děng,empieza ahora no esperes,comece agora não espere
let's begin again,我们重新开始吧,wǒmen chóngxīn kāishǐ ba,empecemos de nuevo,vamos começar de novo
I began working early,我很早开始工作,wǒ hěn zǎo kāishǐ gōngzuò,empecé a trabajar temprano,eu comecei a trabalhar cedo
she began slowly at first,她一开始很慢,tā yī kāishǐ hěn màn,ella empezó lento al principio,ela começou devagar no início
they began together,他们一起开始,tāmen yìqǐ kāishǐ,empezaron juntos,eles começaram juntos
don't break the rules,别违反规则,bié wéifǎn guīzé,no rompas las reglas,não quebre as regras
she broke down crying,她崩溃大哭,tā bēngkuì dàkū,ella se derrumbó llorando,ela desabou chorando
everything fell apart,一切都崩溃了,yíqiè dōu bēngkuì le,todo se desmoronó,tudo desmoronou
