english,chinese,pinyin,spanish,portuguese
I got a new car,我买了辆新车,wǒ mǎi le liàng xīn chē,conseguí un carro nuevo,eu comprei um carro novo
that's a fast car,那是辆快车,nà shì liàng kuài chē,ese es un carro rápido,esse é um carro rápido
there was a car accident,发生了车祸,fāshēng le chēhuò,hubo un accidente de carro,houve um acidente de carro
take the school bus,坐校车,zuò xiàochē,toma el autobús escolar,pegue o ônibus escolar
wait at the bus stop,在公交站等,zài gōngjiāo zhàn děng,espera en la parada de autobús,espere no ponto de ônibus
the main bus station,主要公交站,zhǔyào gōngjiāo zhàn,la estación de autobuses principal,a estação de ônibus principal
catch the fast train,赶快车,gǎn kuài chē,toma el tren rápido,pegue o trem rápido
meet me at train station,在火车站见,zài huǒchē zhàn jiàn,encuéntrame en la estación de tren,me encontre na estação de trem
buy a train ticket,买火车票,mǎi huǒchē piào,compra un boleto de tren,compre uma passagem de trem
travel by plane,坐飞机旅行,zuò fēijī lǚxíng,viajar en avión,viajar de avião
I got my plane ticket,我拿到机票了,wǒ nádào jīpiào le,conseguí mi boleto de avión,eu consegui minha passagem de avião
kids love paper planes,孩子们喜欢纸飞机,háizimen xǐhuan zhǐ fēijī,a los niños les encantan los aviones de papel,crianças amam aviões de papel
our taxi driver was nice,我们的出租车司机很好,wǒmen de chūzūchē sījī hěn hǎo,nuestro taxista fue amable,nosso taxista foi legal
wait at the taxi stand,在出租车站等,zài chūzūchē zhàn děng,espera en la parada de taxis,espere no ponto de táxi
let's take a taxi,我们打车吧,wǒmen dǎchē ba,tomemos un taxi,vamos pegar um táxi
I ride a bicycle to work,我骑自行车上班,wǒ qí zìxíngchē shàngbān,voy en bicicleta al trabajo,eu vou de bicicleta para o trabalho
stay in the bicycle lane,走自行车道,zǒu zìxíngchē dào,mantente en el carril de bicicletas,fique na ciclovia
she has a mountain bike,她有辆山地车,tā yǒu liàng shāndì chē,ella tiene una bicicleta de montaña,ela tem uma mountain bike
hop on the bike,上车,shàng chē,súbete a la bicicleta,suba na bicicleta
enjoy the bike ride,享受骑行,xiǎngshòu qíxíng,disfruta el paseo en bicicleta,aproveite o passeio de bicicleta
use the bike lane,走自行车道,zǒu zìxíngchē dào,usa el carril de bicicletas,use a ciclovia
rent a small boat,租条小船,zū tiáo xiǎo chuán,alquila un bote pequeño,alugue um barco pequeno
we took a sail boat,我们坐了帆船,wǒmen zuò le fānchuán,tomamos un velero,pegamos um veleiro
the boat ride was fun,船上很有趣,chuán shang hěn yǒuqù,el paseo en bote fue divertido,o passeio de barco foi divertido
let's take a walk,我们散步吧,wǒmen sànbù ba,demos un paseo,vamos dar uma caminhada
that was a long walk,那是很长的路,nà shì hěn cháng de lù,fue una caminata larga,foi uma caminhada longa
I'll walk home tonight,我今晚走路回家,wǒ jīnwǎn zǒulù huíjiā,caminaré a casa esta noche,vou caminhar para casa hoje à noite
please drive carefully,请小心驾驶,qǐng xiǎoxīn jiàshǐ,por favor maneja con cuidado,por favor dirija com cuidado
it's a long drive,路程很远,lùchéng hěn yuǎn,es un viaje largo,é uma viagem longa
I'll drive you home,我送你回家,wǒ sòng nǐ huíjiā,te llevaré a casa,eu te levo para casa
going for a car ride,去兜风,qù dōufēng,ir a dar una vuelta en carro,ir dar uma volta de carro
want to ride along,想一起去,xiǎng yìqǐ qù,quieres acompañar,quer ir junto
birds fly high,鸟儿飞得高,niǎo'ér fēi de gāo,los pájaros vuelan alto,pássaros voam alto
watch them fly away,看着它们飞走,kàn zhe tāmen fēi zǒu,míralos volar lejos,veja-os voar para longe
I need to fly home,我要飞回家,wǒ yào fēi huíjiā,necesito volar a casa,eu preciso voar para casa
turn onto main street,转到主街上,zhuǎn dào zhǔ jiē shang,gira hacia la calle principal,vire para a rua principal
it's a busy street,这是条繁忙的街道,zhè shì tiáo fánmáng de jiēdào,es una calle concurrida,é uma rua movimentada
I love street food,我爱街头小吃,wǒ ài jiētóu xiǎochī,me encanta la comida callejera,eu amo comida de rua
it's a long road ahead,前路漫漫,qián lù mànmàn,es un largo camino por delante,é uma longa estrada pela frente
down this country road,沿着这条乡村路,yánzhe zhè tiáo xiāngcūn lù,por este camino rural,por esta estrada rural
let's do a road trip,我们来次公路旅行吧,wǒmen lái cì gōnglù lǚxíng ba,hagamos un viaje por carretera,vamos fazer uma viagem de carro
stuck in heavy traffic,堵在车流里,dǔ zài chēliú lǐ,atrapado en tráfico pesado,preso em trânsito pesado
caught in a traffic jam,遇到堵车,yùdào dǔchē,atrapado en un embotellamiento,preso em um engarrafamento
wait for the traffic light,等红绿灯,děng hónglǜdēng,espera el semáforo,espere o semáforo
there's a stop sign,有停车标志,yǒu tíngchē biāozhì,hay una señal de alto,tem uma placa de pare
stop right there please,请就在那停,qǐng jiù zài nà tíng,para justo ahí por favor,pare aí mesmo por favor
lost my movie ticket,我的电影票丢了,wǒ de diànyǐng piào diū le,perdí mi boleto de cine,perdi meu ingresso de cinema
what's the ticket price,票价多少,piàojià duōshao,¿cuál es el precio del boleto?,qual é o preço do ingresso?
I'm a bus passenger,我是公交乘客,wǒ shì gōngjiāo chéngkè,soy pasajero de autobús,sou passageiro de ônibus
fellow passenger helped me,同车乘客帮了我,tóng chē chéngkè bāng le wǒ,un compañero pasajero me ayudó,um passageiro companheiro me ajudou
busy airport today,今天机场很忙,jīntiān jīchǎng hěn máng,aeropuerto ocupado hoy,aeroporto movimentado hoje
went through airport security,过了机场安检,guò le jīchǎng ānjiǎn,pasé por seguridad del aeropuerto,passei pela segurança do aeroporto
it's an international airport,这是国际机场,zhè shì guójì jīchǎng,es un aeropuerto internacional,é um aeroporto internacional
short trip this time,这次短途旅行,zhè cì duǎntú lǚxíng,viaje corto esta vez,viagem curta desta vez
business trip tomorrow,明天出差,míngtiān chūchāi,viaje de negocios mañana,viagem de negócios amanhã
take a road trip,来次公路旅行,lái cì gōnglù lǚxíng,hacer un viaje por carretera,fazer uma viagem de carro
quick gas station stop,快去加油站,kuài qù jiāyóu zhàn,parada rápida en gasolinera,parada rápida no posto
fill up at the gas station,在加油站加满油,zài jiāyóu zhàn jiā mǎn yóu,llenar en la gasolinera,abastecer no posto
nearest gas station please,最近的加油站在哪,zuìjìn de jiāyóu zhàn zài nǎ,la gasolinera más cercana por favor,posto mais próximo por favor
take public transportation,乘坐公共交通,chéngzuò gōnggòng jiāotōng,toma transporte público,use transporte público
